{
  "hints": {
    "new()address": {
      "call_config": {
        "delete_application": "CREATE"
      }
    }
  },
  "bare_call_config": {
    "no_op": "NEVER",
    "opt_in": "NEVER",
    "close_out": "NEVER",
    "update_application": "NEVER",
    "delete_application": "NEVER"
  },
  "schema": {
    "local": {
      "declared": {},
      "reserved": {}
    },
    "global": {
      "declared": {},
      "reserved": {}
    }
  },
  "state": {
    "global": {
      "num_byte_slices": 0,
      "num_uints": 0
    },
    "local": {
      "num_byte_slices": 0,
      "num_uints": 0
    }
  },
  "source": {
    "approval": "I3ByYWdtYSB2ZXJzaW9uIDEwCgovLyBUaGlzIFRFQUwgd2FzIGdlbmVyYXRlZCBieSBURUFMU2NyaXB0IHYwLjkwLjQKLy8gaHR0cHM6Ly9naXRodWIuY29tL2FsZ29yYW5kZm91bmRhdGlvbi9URUFMU2NyaXB0CgovLyBUaGlzIGNvbnRyYWN0IGlzIGNvbXBsaWFudCB3aXRoIGFuZC9vciBpbXBsZW1lbnRzIHRoZSBmb2xsb3dpbmcgQVJDczogWyBBUkM0IF0KCi8vIFRoZSBmb2xsb3dpbmcgdGVuIGxpbmVzIG9mIFRFQUwgaGFuZGxlIGluaXRpYWwgcHJvZ3JhbSBmbG93Ci8vIFRoaXMgcGF0dGVybiBpcyB1c2VkIHRvIG1ha2UgaXQgZWFzeSBmb3IgYW55b25lIHRvIHBhcnNlIHRoZSBzdGFydCBvZiB0aGUgcHJvZ3JhbSBhbmQgZGV0ZXJtaW5lIGlmIGEgc3BlY2lmaWMgYWN0aW9uIGlzIGFsbG93ZWQKLy8gSGVyZSwgYWN0aW9uIHJlZmVycyB0byB0aGUgT25Db21wbGV0ZSBpbiBjb21iaW5hdGlvbiB3aXRoIHdoZXRoZXIgdGhlIGFwcCBpcyBiZWluZyBjcmVhdGVkIG9yIGNhbGxlZAovLyBFdmVyeSBwb3NzaWJsZSBhY3Rpb24gZm9yIHRoaXMgY29udHJhY3QgaXMgcmVwcmVzZW50ZWQgaW4gdGhlIHN3aXRjaCBzdGF0ZW1lbnQKLy8gSWYgdGhlIGFjdGlvbiBpcyBub3QgaW1wbGVtZW50ZWQgaW4gdGhlIGNvbnRyYWN0LCBpdHMgcmVzcGVjdGl2ZSBicmFuY2ggd2lsbCBiZSAiKk5PVF9JTVBMRU1FTlRFRCIgd2hpY2gganVzdCBjb250YWlucyAiZXJyIgp0eG4gQXBwbGljYXRpb25JRAohCmludCA2CioKdHhuIE9uQ29tcGxldGlvbgorCnN3aXRjaCAqTk9UX0lNUExFTUVOVEVEICpOT1RfSU1QTEVNRU5URUQgKk5PVF9JTVBMRU1FTlRFRCAqTk9UX0lNUExFTUVOVEVEICpOT1RfSU1QTEVNRU5URUQgKk5PVF9JTVBMRU1FTlRFRCAqTk9UX0lNUExFTUVOVEVEICpOT1RfSU1QTEVNRU5URUQgKk5PVF9JTVBMRU1FTlRFRCAqTk9UX0lNUExFTUVOVEVEICpOT1RfSU1QTEVNRU5URUQgKmNyZWF0ZV9EZWxldGVBcHBsaWNhdGlvbgoKKk5PVF9JTVBMRU1FTlRFRDoKCWVycgoKLy8gbmV3KClhZGRyZXNzCiphYmlfcm91dGVfbmV3OgoJLy8gVGhlIEFCSSByZXR1cm4gcHJlZml4CglieXRlIDB4MTUxZjdjNzUKCgkvLyBleGVjdXRlIG5ldygpYWRkcmVzcwoJY2FsbHN1YiBuZXcKCWNvbmNhdAoJbG9nCglpbnQgMQoJcmV0dXJuCgovLyBuZXcoKTogQWRkcmVzcwpuZXc6Cglwcm90byAwIDEKCgkvLyBjb250cmFjdHMvYXJjNTkuYWxnby50czoyNwoJLy8gc2VuZFBheW1lbnQoewoJLy8gICAgICAgcmVrZXlUbzogdGhpcy50eG4uc2VuZGVyLAoJLy8gICAgIH0pCglpdHhuX2JlZ2luCglpbnQgcGF5CglpdHhuX2ZpZWxkIFR5cGVFbnVtCgoJLy8gY29udHJhY3RzL2FyYzU5LmFsZ28udHM6MjgKCS8vIHJla2V5VG86IHRoaXMudHhuLnNlbmRlcgoJdHhuIFNlbmRlcgoJaXR4bl9maWVsZCBSZWtleVRvCgoJLy8gRmVlIGZpZWxkIG5vdCBzZXQsIGRlZmF1bHRpbmcgdG8gMAoJaW50IDAKCWl0eG5fZmllbGQgRmVlCgoJLy8gU3VibWl0IGlubmVyIHRyYW5zYWN0aW9uCglpdHhuX3N1Ym1pdAoKCS8vIGNvbnRyYWN0cy9hcmM1OS5hbGdvLnRzOjMxCgkvLyByZXR1cm4gdGhpcy5hcHAuYWRkcmVzczsKCWdsb2JhbCBDdXJyZW50QXBwbGljYXRpb25BZGRyZXNzCglyZXRzdWIKCipjcmVhdGVfRGVsZXRlQXBwbGljYXRpb246CgltZXRob2QgIm5ldygpYWRkcmVzcyIKCXR4bmEgQXBwbGljYXRpb25BcmdzIDAKCW1hdGNoICphYmlfcm91dGVfbmV3CgllcnI=",
    "clear": "I3ByYWdtYSB2ZXJzaW9uIDEw"
  },
  "contract": {
    "name": "ControlledAddress",
    "desc": "",
    "methods": [
      {
        "name": "new",
        "args": [],
        "returns": {
          "type": "address"
        }
      }
    ]
  }
}