{
    "hints": {
        "create(byte[])void": {
            "call_config": {
                "no_op": "CREATE"
            }
        },
        "rekey(address)void": {
            "call_config": {
                "no_op": "CALL"
            }
        },
        "delete()void": {
            "call_config": {
                "delete_application": "CALL"
            }
        }
    },
    "source": {
        "approval": "I3ByYWdtYSB2ZXJzaW9uIDEwCiNwcmFnbWEgdHlwZXRyYWNrIGZhbHNlCgovLyBAYWxnb3JhbmRmb3VuZGF0aW9uL2FsZ29yYW5kLXR5cGVzY3JpcHQvYXJjNC9pbmRleC5kLnRzOjpDb250cmFjdC5hcHByb3ZhbFByb2dyYW0oKSAtPiB1aW50NjQ6Cm1haW46CiAgICBpbnRjYmxvY2sgMSAwCiAgICAvLyBzbWFydF9jb250cmFjdHMvZXNjcm93L2NvbnRyYWN0LmFsZ28udHM6NgogICAgLy8gZXhwb3J0IGNsYXNzIEVzY3JvdyBleHRlbmRzIENvbnRyYWN0IHsKICAgIHR4biBOdW1BcHBBcmdzCiAgICBieiBtYWluX2FmdGVyX2lmX2Vsc2VAOQogICAgcHVzaGJ5dGVzcyAweDhlNzkzNThkIDB4NjVhOTdiY2MgMHgyNDM3OGQzYyAvLyBtZXRob2QgImNyZWF0ZShieXRlW10pdm9pZCIsIG1ldGhvZCAicmVrZXkoYWRkcmVzcyl2b2lkIiwgbWV0aG9kICJkZWxldGUoKXZvaWQiCiAgICB0eG5hIEFwcGxpY2F0aW9uQXJncyAwCiAgICBtYXRjaCBtYWluX2NyZWF0ZV9yb3V0ZUAzIG1haW5fcmVrZXlfcm91dGVANCBtYWluX2RlbGV0ZV9yb3V0ZUA1CgptYWluX2FmdGVyX2lmX2Vsc2VAOToKICAgIC8vIHNtYXJ0X2NvbnRyYWN0cy9lc2Nyb3cvY29udHJhY3QuYWxnby50czo2CiAgICAvLyBleHBvcnQgY2xhc3MgRXNjcm93IGV4dGVuZHMgQ29udHJhY3QgewogICAgaW50Y18xIC8vIDAKICAgIHJldHVybgoKbWFpbl9kZWxldGVfcm91dGVANToKICAgIC8vIHNtYXJ0X2NvbnRyYWN0cy9lc2Nyb3cvY29udHJhY3QuYWxnby50czoyNwogICAgLy8gQGFiaW1ldGhvZCh7IGFsbG93QWN0aW9uczogJ0RlbGV0ZUFwcGxpY2F0aW9uJyB9KQogICAgdHhuIE9uQ29tcGxldGlvbgogICAgcHVzaGludCA1IC8vIERlbGV0ZUFwcGxpY2F0aW9uCiAgICA9PQogICAgYXNzZXJ0IC8vIE9uQ29tcGxldGlvbiBpcyBub3QgRGVsZXRlQXBwbGljYXRpb24KICAgIHR4biBBcHBsaWNhdGlvbklECiAgICBhc3NlcnQgLy8gY2FuIG9ubHkgY2FsbCB3aGVuIG5vdCBjcmVhdGluZwogICAgY2FsbHN1YiBkZWxldGUKICAgIGludGNfMCAvLyAxCiAgICByZXR1cm4KCm1haW5fcmVrZXlfcm91dGVANDoKICAgIC8vIHNtYXJ0X2NvbnRyYWN0cy9lc2Nyb3cvY29udHJhY3QuYWxnby50czoxNQogICAgLy8gcmVrZXkocmVrZXlUbzogQWNjb3VudCk6IHZvaWQgewogICAgdHhuIE9uQ29tcGxldGlvbgogICAgIQogICAgYXNzZXJ0IC8vIE9uQ29tcGxldGlvbiBpcyBub3QgTm9PcAogICAgdHhuIEFwcGxpY2F0aW9uSUQKICAgIGFzc2VydCAvLyBjYW4gb25seSBjYWxsIHdoZW4gbm90IGNyZWF0aW5nCiAgICAvLyBzbWFydF9jb250cmFjdHMvZXNjcm93L2NvbnRyYWN0LmFsZ28udHM6NgogICAgLy8gZXhwb3J0IGNsYXNzIEVzY3JvdyBleHRlbmRzIENvbnRyYWN0IHsKICAgIHR4bmEgQXBwbGljYXRpb25BcmdzIDEKICAgIC8vIHNtYXJ0X2NvbnRyYWN0cy9lc2Nyb3cvY29udHJhY3QuYWxnby50czoxNQogICAgLy8gcmVrZXkocmVrZXlUbzogQWNjb3VudCk6IHZvaWQgewogICAgY2FsbHN1YiByZWtleQogICAgaW50Y18wIC8vIDEKICAgIHJldHVybgoKbWFpbl9jcmVhdGVfcm91dGVAMzoKICAgIC8vIHNtYXJ0X2NvbnRyYWN0cy9lc2Nyb3cvY29udHJhY3QuYWxnby50czoxMAogICAgLy8gQGFiaW1ldGhvZCh7IG9uQ3JlYXRlOiAncmVxdWlyZScgfSkKICAgIHR4biBPbkNvbXBsZXRpb24KICAgICEKICAgIGFzc2VydCAvLyBPbkNvbXBsZXRpb24gaXMgbm90IE5vT3AKICAgIHR4biBBcHBsaWNhdGlvbklECiAgICAhCiAgICBhc3NlcnQgLy8gY2FuIG9ubHkgY2FsbCB3aGVuIGNyZWF0aW5nCiAgICAvLyBzbWFydF9jb250cmFjdHMvZXNjcm93L2NvbnRyYWN0LmFsZ28udHM6NgogICAgLy8gZXhwb3J0IGNsYXNzIEVzY3JvdyBleHRlbmRzIENvbnRyYWN0IHsKICAgIHR4bmEgQXBwbGljYXRpb25BcmdzIDEKICAgIGV4dHJhY3QgMiAwCiAgICAvLyBzbWFydF9jb250cmFjdHMvZXNjcm93L2NvbnRyYWN0LmFsZ28udHM6MTAKICAgIC8vIEBhYmltZXRob2QoeyBvbkNyZWF0ZTogJ3JlcXVpcmUnIH0pCiAgICBjYWxsc3ViIGNyZWF0ZQogICAgaW50Y18wIC8vIDEKICAgIHJldHVybgoKCi8vIHNtYXJ0X2NvbnRyYWN0cy9lc2Nyb3cvY29udHJhY3QuYWxnby50czo6RXNjcm93LmNyZWF0ZShjcmVhdG9yOiBieXRlcykgLT4gdm9pZDoKY3JlYXRlOgogICAgLy8gc21hcnRfY29udHJhY3RzL2VzY3Jvdy9jb250cmFjdC5hbGdvLnRzOjEwLTExCiAgICAvLyBAYWJpbWV0aG9kKHsgb25DcmVhdGU6ICdyZXF1aXJlJyB9KQogICAgLy8gY3JlYXRlKGNyZWF0b3I6IGJ5dGVzKTogdm9pZCB7CiAgICBwcm90byAxIDAKICAgIC8vIHNtYXJ0X2NvbnRyYWN0cy9lc2Nyb3cvY29udHJhY3QuYWxnby50czo4CiAgICAvLyBjcmVhdG9yID0gR2xvYmFsU3RhdGU8Ynl0ZXM+KHsga2V5OiBFc2Nyb3dHbG9iYWxTdGF0ZUtleXNDcmVhdG9yIH0pCiAgICBwdXNoYnl0ZXMgImNyZWF0b3IiCiAgICAvLyBzbWFydF9jb250cmFjdHMvZXNjcm93L2NvbnRyYWN0LmFsZ28udHM6MTIKICAgIC8vIHRoaXMuY3JlYXRvci52YWx1ZSA9IGNyZWF0b3IKICAgIGZyYW1lX2RpZyAtMQogICAgYXBwX2dsb2JhbF9wdXQKICAgIHJldHN1YgoKCi8vIHNtYXJ0X2NvbnRyYWN0cy9lc2Nyb3cvY29udHJhY3QuYWxnby50czo6RXNjcm93LnJla2V5KHJla2V5VG86IGJ5dGVzKSAtPiB2b2lkOgpyZWtleToKICAgIC8vIHNtYXJ0X2NvbnRyYWN0cy9lc2Nyb3cvY29udHJhY3QuYWxnby50czoxNQogICAgLy8gcmVrZXkocmVrZXlUbzogQWNjb3VudCk6IHZvaWQgewogICAgcHJvdG8gMSAwCiAgICAvLyBzbWFydF9jb250cmFjdHMvZXNjcm93L2NvbnRyYWN0LmFsZ28udHM6MTYKICAgIC8vIGFzc2VydChUeG4uc2VuZGVyID09PSBHbG9iYWwuY3JlYXRvckFkZHJlc3MsIEVSUl9PTkxZX0NSRUFUT1JfQ0FOX1JFS0VZKQogICAgdHhuIFNlbmRlcgogICAgZ2xvYmFsIENyZWF0b3JBZGRyZXNzCiAgICA9PQogICAgYXNzZXJ0IC8vIG9ubHkgdGhlIGNyZWF0b3IgY2FuIHJla2V5IGFuIGVzY3JvdyBjb250cmFjdAogICAgLy8gc21hcnRfY29udHJhY3RzL2VzY3Jvdy9jb250cmFjdC5hbGdvLnRzOjE4LTI0CiAgICAvLyBpdHhuCiAgICAvLyAgIC5wYXltZW50KHsKICAgIC8vICAgICBhbW91bnQ6IDAsCiAgICAvLyAgICAgcmVjZWl2ZXI6IEdsb2JhbC5jdXJyZW50QXBwbGljYXRpb25BZGRyZXNzLAogICAgLy8gICAgIHJla2V5VG8KICAgIC8vICAgfSkKICAgIC8vICAgLnN1Ym1pdCgpCiAgICBpdHhuX2JlZ2luCiAgICAvLyBzbWFydF9jb250cmFjdHMvZXNjcm93L2NvbnRyYWN0LmFsZ28udHM6MjEKICAgIC8vIHJlY2VpdmVyOiBHbG9iYWwuY3VycmVudEFwcGxpY2F0aW9uQWRkcmVzcywKICAgIGdsb2JhbCBDdXJyZW50QXBwbGljYXRpb25BZGRyZXNzCiAgICBmcmFtZV9kaWcgLTEKICAgIGl0eG5fZmllbGQgUmVrZXlUbwogICAgaXR4bl9maWVsZCBSZWNlaXZlcgogICAgLy8gc21hcnRfY29udHJhY3RzL2VzY3Jvdy9jb250cmFjdC5hbGdvLnRzOjIwCiAgICAvLyBhbW91bnQ6IDAsCiAgICBpbnRjXzEgLy8gMAogICAgaXR4bl9maWVsZCBBbW91bnQKICAgIC8vIHNtYXJ0X2NvbnRyYWN0cy9lc2Nyb3cvY29udHJhY3QuYWxnby50czoxOC0yMwogICAgLy8gaXR4bgogICAgLy8gICAucGF5bWVudCh7CiAgICAvLyAgICAgYW1vdW50OiAwLAogICAgLy8gICAgIHJlY2VpdmVyOiBHbG9iYWwuY3VycmVudEFwcGxpY2F0aW9uQWRkcmVzcywKICAgIC8vICAgICByZWtleVRvCiAgICAvLyAgIH0pCiAgICBpbnRjXzAgLy8gMQogICAgaXR4bl9maWVsZCBUeXBlRW51bQogICAgaW50Y18xIC8vIDAKICAgIGl0eG5fZmllbGQgRmVlCiAgICAvLyBzbWFydF9jb250cmFjdHMvZXNjcm93L2NvbnRyYWN0LmFsZ28udHM6MTgtMjQKICAgIC8vIGl0eG4KICAgIC8vICAgLnBheW1lbnQoewogICAgLy8gICAgIGFtb3VudDogMCwKICAgIC8vICAgICByZWNlaXZlcjogR2xvYmFsLmN1cnJlbnRBcHBsaWNhdGlvbkFkZHJlc3MsCiAgICAvLyAgICAgcmVrZXlUbwogICAgLy8gICB9KQogICAgLy8gICAuc3VibWl0KCkKICAgIGl0eG5fc3VibWl0CiAgICByZXRzdWIKCgovLyBzbWFydF9jb250cmFjdHMvZXNjcm93L2NvbnRyYWN0LmFsZ28udHM6OkVzY3Jvdy5kZWxldGUoKSAtPiB2b2lkOgpkZWxldGU6CiAgICAvLyBzbWFydF9jb250cmFjdHMvZXNjcm93L2NvbnRyYWN0LmFsZ28udHM6MjkKICAgIC8vIGFzc2VydChUeG4uc2VuZGVyID09PSBHbG9iYWwuY3JlYXRvckFkZHJlc3MsIEVSUl9PTkxZX0ZBQ1RPUllfQ0FOX0RFTEVURSkKICAgIHR4biBTZW5kZXIKICAgIGdsb2JhbCBDcmVhdG9yQWRkcmVzcwogICAgPT0KICAgIGFzc2VydCAvLyBvbmx5IHRoZSBmYWN0b3J5IGNhbiBkZWxldGUgYW4gZXNjcm93IGNvbnRyYWN0CiAgICAvLyBzbWFydF9jb250cmFjdHMvZXNjcm93L2NvbnRyYWN0LmFsZ28udHM6MzEtMzMKICAgIC8vIGl0eG4KICAgIC8vICAgLnBheW1lbnQoeyBjbG9zZVJlbWFpbmRlclRvOiBHbG9iYWwuY3JlYXRvckFkZHJlc3MgfSkKICAgIC8vICAgLnN1Ym1pdCgpCiAgICBpdHhuX2JlZ2luCiAgICAvLyBzbWFydF9jb250cmFjdHMvZXNjcm93L2NvbnRyYWN0LmFsZ28udHM6MzIKICAgIC8vIC5wYXltZW50KHsgY2xvc2VSZW1haW5kZXJUbzogR2xvYmFsLmNyZWF0b3JBZGRyZXNzIH0pCiAgICBnbG9iYWwgQ3JlYXRvckFkZHJlc3MKICAgIGl0eG5fZmllbGQgQ2xvc2VSZW1haW5kZXJUbwogICAgLy8gc21hcnRfY29udHJhY3RzL2VzY3Jvdy9jb250cmFjdC5hbGdvLnRzOjMxLTMyCiAgICAvLyBpdHhuCiAgICAvLyAgIC5wYXltZW50KHsgY2xvc2VSZW1haW5kZXJUbzogR2xvYmFsLmNyZWF0b3JBZGRyZXNzIH0pCiAgICBpbnRjXzAgLy8gMQogICAgaXR4bl9maWVsZCBUeXBlRW51bQogICAgaW50Y18xIC8vIDAKICAgIGl0eG5fZmllbGQgRmVlCiAgICAvLyBzbWFydF9jb250cmFjdHMvZXNjcm93L2NvbnRyYWN0LmFsZ28udHM6MzEtMzMKICAgIC8vIGl0eG4KICAgIC8vICAgLnBheW1lbnQoeyBjbG9zZVJlbWFpbmRlclRvOiBHbG9iYWwuY3JlYXRvckFkZHJlc3MgfSkKICAgIC8vICAgLnN1Ym1pdCgpCiAgICBpdHhuX3N1Ym1pdAogICAgcmV0c3ViCg==",
        "clear": "I3ByYWdtYSB2ZXJzaW9uIDEwCiNwcmFnbWEgdHlwZXRyYWNrIGZhbHNlCgovLyBAYWxnb3JhbmRmb3VuZGF0aW9uL2FsZ29yYW5kLXR5cGVzY3JpcHQvYmFzZS1jb250cmFjdC5kLnRzOjpCYXNlQ29udHJhY3QuY2xlYXJTdGF0ZVByb2dyYW0oKSAtPiB1aW50NjQ6Cm1haW46CiAgICBwdXNoaW50IDEgLy8gMQogICAgcmV0dXJuCg=="
    },
    "state": {
        "global": {
            "num_byte_slices": 1,
            "num_uints": 0
        },
        "local": {
            "num_byte_slices": 0,
            "num_uints": 0
        }
    },
    "schema": {
        "global": {
            "declared": {
                "creator": {
                    "type": "bytes",
                    "key": "creator"
                }
            },
            "reserved": {}
        },
        "local": {
            "declared": {},
            "reserved": {}
        }
    },
    "contract": {
        "name": "Escrow",
        "methods": [
            {
                "name": "create",
                "args": [
                    {
                        "type": "byte[]",
                        "name": "creator"
                    }
                ],
                "readonly": false,
                "returns": {
                    "type": "void"
                }
            },
            {
                "name": "rekey",
                "args": [
                    {
                        "type": "address",
                        "name": "rekeyTo"
                    }
                ],
                "readonly": false,
                "returns": {
                    "type": "void"
                }
            },
            {
                "name": "delete",
                "args": [],
                "readonly": false,
                "returns": {
                    "type": "void"
                }
            }
        ],
        "networks": {}
    },
    "bare_call_config": {}
}